{
  "$schema": "../../schema/spell.schema.json",
  "id": "armadura-arcana",
  "name": "Armadura Arcana",
  "level": 1,
  "levelLabel": "1º Círculo",
  "school": "Abjuração",
  "classes": [
    "Feiticeiro",
    "Mago"
  ],
  "castingTime": "Ação",
  "range": "Toque",
  "components": {
    "verbal": true,
    "somatic": true,
    "material": true,
    "materialDescription": "um pedaço de couro curtido",
    "text": "V, S, M (um pedaço de couro curtido)"
  },
  "duration": "8 horas",
  "concentration": false,
  "ritual": false,
  "description": "Você toca uma criatura voluntária que não está usando armadura. Até que a magia termine, a CA base do alvo se torna 13 mais o modificador de Destreza dele. A\nmagia se encerra se o alvo vestir uma armadura.",
  "source": {
    "book": "Livro do Jogador 2024",
    "language": "pt-BR",
    "chapter": 7,
    "chapterTitle": "Magias",
    "pdfPath": "doc/livro-jogador.pdf",
    "pdfPages": [
      241,
      349
    ],
    "extractedAt": "2026-06-25T01:53:01.494Z"
  }
}
