{
  "$schema": "../../schema/spell.schema.json",
  "id": "toque-necrotico",
  "name": "Toque Necrótico",
  "level": 0,
  "levelLabel": "Truque",
  "school": "Necromancia",
  "classes": [
    "Bruxo",
    "Feiticeiro",
    "Mago"
  ],
  "castingTime": "Ação",
  "range": "Toque",
  "components": {
    "verbal": true,
    "somatic": true,
    "material": false,
    "materialDescription": null,
    "text": "V, S"
  },
  "duration": "Instantânea",
  "concentration": false,
  "ritual": false,
  "description": "Canalizando o frio da sepultura, realize um ataque mágico corpo a corpo contra um alvo no alcance da magia. Em caso de acerto, o alvo sofre 1d10 pontos de dano Necrótico e não pode recuperar Pontos de Vida até o final do seu próximo turno.\nAprimoramento de Truque. O dano aumenta em 1d10\nquando você atinge os níveis 5 (2d10), 11 (3d10) e 17 (4d10).",
  "source": {
    "book": "Livro do Jogador 2024",
    "language": "pt-BR",
    "chapter": 7,
    "chapterTitle": "Magias",
    "pdfPath": "doc/livro-jogador.pdf",
    "pdfPages": [
      241,
      349
    ],
    "extractedAt": "2026-06-25T01:53:01.647Z"
  }
}
