{
  "$schema": "../../schema/spell.schema.json",
  "id": "esfera-resiliente-de-otiluke",
  "name": "Esfera Resiliente de Otiluke",
  "level": 4,
  "levelLabel": "4º Círculo",
  "school": "Abjuração",
  "classes": [
    "Mago"
  ],
  "castingTime": "Ação",
  "range": "9 metros",
  "components": {
    "verbal": true,
    "somatic": true,
    "material": true,
    "materialDescription": "uma esfera de vidro",
    "text": "V, S, M (uma esfera de vidro)"
  },
  "duration": "Concentração, até 1 minuto",
  "concentration": true,
  "ritual": false,
  "description": "Uma Esfera cintilante envolve uma criatura ou objeto\nGrande ou menor no alcance da magia. Uma criatura involuntária deve ser bem-sucedida em uma salvaguarda de Destreza ou é envolta pela duração da magia.\nNada — nem objetos físicos, energia ou outros efeitos de magia — pode atravessar a barreira, para dentro ou para fora, embora uma criatura na Esfera possa respirar lá. A Esfera é imune a todos os tipos de dano, e uma criatura ou objeto dentro dela não pode ser danificado por ataques ou efeitos provenientes de fora, nem uma criatura dentro da Esfera pode causar dano a qualquer coisa fora dela.\nA Esfera não tem peso e é grande o suficiente para conter a criatura ou objeto em seu interior. Uma criatura envolta pode executar uma ação para empurrar-se contra as paredes da Esfera e, assim, rolar a Esfera a até metade do Deslocamento da criatura. Da mesma forma,\no globo pode ser pego e movido por outras criaturas.\nUma magia Desintegrar que tenha o globo como alvo o destrói sem prejudicar nada em seu interior.",
  "source": {
    "book": "Livro do Jogador 2024",
    "language": "pt-BR",
    "chapter": 7,
    "chapterTitle": "Magias",
    "pdfPath": "doc/livro-jogador.pdf",
    "pdfPages": [
      241,
      349
    ],
    "extractedAt": "2026-06-25T01:53:01.554Z"
  }
}
