{
  "$schema": "../../schema/spell.schema.json",
  "id": "danca-irresistivel-de-otto",
  "name": "Dança Irresistível de Otto",
  "level": 6,
  "levelLabel": "6º Círculo",
  "school": "Encantamento",
  "classes": [
    "Bardo",
    "Mago"
  ],
  "castingTime": "Ação",
  "range": "9 metros",
  "components": {
    "verbal": true,
    "somatic": false,
    "material": false,
    "materialDescription": null,
    "text": "V"
  },
  "duration": "Concentração, até 1 minuto",
  "concentration": true,
  "ritual": false,
  "description": "Uma criatura à sua vista e no alcance da magia deve realizar uma salvaguarda de Sabedoria. Em caso de sucesso, o alvo dança comicamente até o final do próximo turno dele, durante o qual ele deve gastar todo o movimento para dançar no mesmo lugar.\nSe falhar, o alvo tem a condição Enfeitiçado pela duração da magia. Enquanto Enfeitiçado, o alvo dança comicamente, deve usar todo o seu movimento para dançar no mesmo lugar e tem Desvantagem em salvaguardas de Destreza e jogadas de ataque, e outras criaturas têm Vantagem em jogadas de ataque contra ele. Em cada um dos turnos do alvo, ele pode executar uma ação para se recompor e repetir a salvaguarda,\nencerrando a magia em caso de sucesso.",
  "source": {
    "book": "Livro do Jogador 2024",
    "language": "pt-BR",
    "chapter": 7,
    "chapterTitle": "Magias",
    "pdfPath": "doc/livro-jogador.pdf",
    "pdfPages": [
      241,
      349
    ],
    "extractedAt": "2026-06-25T01:53:01.535Z"
  }
}
