{
  "$schema": "../../schema/spell.schema.json",
  "id": "identificar",
  "name": "Identificar",
  "level": 1,
  "levelLabel": "1º Círculo",
  "school": "Adivinhação",
  "classes": [
    "Bardo",
    "Mago"
  ],
  "castingTime": "1 minuto ou Ritual",
  "range": "Toque",
  "components": {
    "verbal": true,
    "somatic": true,
    "material": true,
    "materialDescription": "uma pérola no valor de 100 ou mais PO",
    "text": "V, S, M (uma pérola no valor de 100 ou mais PO)"
  },
  "duration": "Instantânea",
  "concentration": false,
  "ritual": true,
  "description": "Você toca um objeto durante a conjuração da magia.\nSe for um item mágico ou algum outro objeto mágico,\nvocê descobre suas propriedades e como usá-las, se ele requer Sintonização e quantas cargas possui, se houver. Você também descobre se alguma magia está afetando o item e quais são elas. Se o item foi criado por uma magia, você identifica o nome dessa magia.\nSe em vez disso você tocar uma criatura durante a conjuração, você descobre quais magias a estão afetando, caso estejam.",
  "source": {
    "book": "Livro do Jogador 2024",
    "language": "pt-BR",
    "chapter": 7,
    "chapterTitle": "Magias",
    "pdfPath": "doc/livro-jogador.pdf",
    "pdfPages": [
      241,
      349
    ],
    "extractedAt": "2026-06-25T01:53:01.567Z"
  }
}
