{
  "$schema": "../../schema/spell.schema.json",
  "id": "caminhar-sobre-as-aguas",
  "name": "Caminhar Sobre as Águas",
  "level": 3,
  "levelLabel": "3º Círculo",
  "school": "Transmutação",
  "classes": [
    "Clérigo",
    "Druida",
    "Feiticeiro",
    "Guardião"
  ],
  "castingTime": "Ação ou Ritual",
  "range": "9 metros",
  "components": {
    "verbal": true,
    "somatic": true,
    "material": true,
    "materialDescription": "um pedaço de cortiça",
    "text": "V, S, M (um pedaço de cortiça)"
  },
  "duration": "1 hora",
  "concentration": false,
  "ritual": true,
  "description": "Esta magia concede a capacidade de se mover através de qualquer superfície líquida — como ácido, água,\nareia movediça, lama, lava ou neve — como se fosse um solo sólido inofensivo (criaturas que cruzam a lava derretida ainda podem sofrer dano devido ao calor). Até dez criaturas voluntárias à sua escolha no alcance da magia recebem essa habilidade pela duração da magia.\nUm alvo afetado deve executar uma Ação Bônus para passar da superfície do líquido para dentro dele e vice-versa, mas, se o alvo cair no líquido, ele atravessa a superfície e entra no líquido abaixo.",
  "source": {
    "book": "Livro do Jogador 2024",
    "language": "pt-BR",
    "chapter": 7,
    "chapterTitle": "Magias",
    "pdfPath": "doc/livro-jogador.pdf",
    "pdfPages": [
      241,
      349
    ],
    "extractedAt": "2026-06-25T01:53:01.507Z"
  }
}
