{
  "$schema": "../../schema/spell.schema.json",
  "id": "comunhao-com-a-natureza",
  "name": "Comunhão com a Natureza",
  "level": 5,
  "levelLabel": "5º Círculo",
  "school": "Adivinhação",
  "classes": [
    "Druida",
    "Guardião"
  ],
  "castingTime": "1 minuto ou Ritual",
  "range": "Pessoal",
  "components": {
    "verbal": true,
    "somatic": true,
    "material": false,
    "materialDescription": null,
    "text": "V, S"
  },
  "duration": "Instantânea",
  "concentration": false,
  "ritual": true,
  "description": "Você comunga com os espíritos da natureza adquirindo conhecimento da área circundante. Ao ar livre, a magia lhe dá conhecimento da área a até 5 quilômetros de você. Em cavernas e outros ambientes subterrâneos naturais, o raio é limitado a 90 metros. A magia não funciona onde a natureza foi substituída por construções, como em castelos e povoados.\nEscolha três dos seguintes fatos; você aprende esses fatos no que se refere à área da magia:\n• Localização de povoados\n• Localização de portais para outros planos de existência\n• Localização de uma criatura de Nível de Desafio 10\nou maior (à escolha do Mestre) que seja Celestial,\nElemental, Feérico, Ínfero ou Morto-vivo\n• O tipo mais predominante de planta, mineral ou Fera\n(você escolhe sobre qual aprender)\n• Localização de corpos d’água\nPor exemplo, você pode determinar a localização de um monstro poderoso na área, os locais dos corpos d’água e os locais de quaisquer povoados.",
  "source": {
    "book": "Livro do Jogador 2024",
    "language": "pt-BR",
    "chapter": 7,
    "chapterTitle": "Magias",
    "pdfPath": "doc/livro-jogador.pdf",
    "pdfPages": [
      241,
      349
    ],
    "extractedAt": "2026-06-25T01:53:01.518Z"
  }
}
