{
  "$schema": "../../schema/spell.schema.json",
  "id": "talho-mental",
  "name": "Talho Mental",
  "level": 0,
  "levelLabel": "Truque",
  "school": "Encantamento",
  "classes": [
    "Bruxo",
    "Feiticeiro",
    "Mago"
  ],
  "castingTime": "Ação",
  "range": "18 metros",
  "components": {
    "verbal": true,
    "somatic": false,
    "material": false,
    "materialDescription": null,
    "text": "V"
  },
  "duration": "1 rodada",
  "concentration": false,
  "ritual": false,
  "description": "Você tenta fragmentar temporariamente a mente de uma criatura à sua vista e no alcance da magia. O alvo deve ser bem-sucedido em uma salvaguarda de Inteligência ou sofre 1d6 pontos de dano Psíquico e subtrai\n1d4 da próxima salvaguarda que realizar antes do final do seu próximo turno.\nAprimoramento de Truque. O dano aumenta em 1d6\nquando você atinge os níveis 5 (2d6), 11 (3d6) e 17 (4d6).",
  "source": {
    "book": "Livro do Jogador 2024",
    "language": "pt-BR",
    "chapter": 7,
    "chapterTitle": "Magias",
    "pdfPath": "doc/livro-jogador.pdf",
    "pdfPages": [
      241,
      349
    ],
    "extractedAt": "2026-06-25T01:53:01.641Z"
  }
}
