{
  "$schema": "../../schema/spell.schema.json",
  "id": "mensagem",
  "name": "Mensagem",
  "level": 0,
  "levelLabel": "Truque",
  "school": "Transmutação",
  "classes": [
    "Bardo",
    "Druida",
    "Feiticeiro",
    "Mago"
  ],
  "castingTime": "Ação",
  "range": "36 metros",
  "components": {
    "verbal": false,
    "somatic": true,
    "material": true,
    "materialDescription": "um fio de cobre",
    "text": "S, M (um fio de cobre)"
  },
  "duration": "1 rodada",
  "concentration": false,
  "ritual": false,
  "description": "Você aponta para uma criatura no alcance da magia e sussurra uma mensagem. Somente o alvo ouve a mensagem e pode responder em um sussurro que apenas você consegue ouvir.\nVocê pode conjurar essa magia através de objetos sólidos se estiver familiarizado com o alvo e souber que ele está além da barreira. Silêncio mágico, 30 centímetros de pedra, metal ou madeira, ou uma fina folha de chumbo bloqueiam a magia.",
  "source": {
    "book": "Livro do Jogador 2024",
    "language": "pt-BR",
    "chapter": 7,
    "chapterTitle": "Magias",
    "pdfPath": "doc/livro-jogador.pdf",
    "pdfPages": [
      241,
      349
    ],
    "extractedAt": "2026-06-25T01:53:01.590Z"
  }
}
