{
  "$schema": "../../schema/spell.schema.json",
  "id": "invisibilidade",
  "name": "Invisibilidade",
  "level": 2,
  "levelLabel": "2º Círculo",
  "school": "Ilusão",
  "classes": [
    "Bardo",
    "Bruxo",
    "Feiticeiro",
    "Mago"
  ],
  "castingTime": "Ação",
  "range": "Toque",
  "components": {
    "verbal": true,
    "somatic": true,
    "material": true,
    "materialDescription": "um cílio envolto em goma arábica",
    "text": "V, S, M (um cílio envolto em goma arábica)"
  },
  "duration": "Concentração, até 1 hora",
  "concentration": true,
  "ritual": false,
  "description": "Uma criatura que você toca tem a condição Invisível até que a magia termine. A magia se encerra antes se o alvo realizar uma jogada de ataque, causar dano ou conjurar uma magia.",
  "higherLevels": "Usando um Espaço de Magia de Círculo Superior.\nVocê pode escolher uma criatura adicional para cada círculo de espaço de magia acima de 2.",
  "source": {
    "book": "Livro do Jogador 2024",
    "language": "pt-BR",
    "chapter": 7,
    "chapterTitle": "Magias",
    "pdfPath": "doc/livro-jogador.pdf",
    "pdfPages": [
      241,
      349
    ],
    "extractedAt": "2026-06-25T01:53:01.571Z"
  }
}
