{
  "$schema": "../../schema/spell.schema.json",
  "id": "transicao-planar",
  "name": "Transição Planar",
  "level": 7,
  "levelLabel": "7º Círculo",
  "school": "Invocação",
  "classes": [
    "Bruxo",
    "Clérigo",
    "Druida",
    "Feiticeiro",
    "Mago"
  ],
  "castingTime": "Ação",
  "range": "Toque",
  "components": {
    "verbal": true,
    "somatic": true,
    "material": true,
    "materialDescription": "uma haste de metal bifurcada no valor de 250 ou mais PO e sintonizada a um plano de existência",
    "text": "V, S, M (uma haste de metal bifurcada no valor de 250 ou mais PO e sintonizada a um plano de existência)"
  },
  "duration": "Instantânea",
  "concentration": false,
  "ritual": false,
  "description": "Você e até oito criaturas voluntárias que dão as mãos em um círculo são transportadas para um plano de existência diferente. Você pode especificar um destino-alvo em termos gerais, como a Cidade de Latão no Plano Elemental do Fogo ou o palácio de Dispater no segundo nível dos Nove Infernos, e você aparece dentro ou perto desse destino, conforme determinado pelo Mestre.\nComo alternativa, se você souber a sequência de símbolos de um círculo de teleporte em outro plano de existência, esta magia pode levá-lo a esse círculo. Se o círculo de teleporte for pequeno demais para caber todas as criaturas que você transportou, elas aparecem nos espaços desocupados mais próximos ao círculo.",
  "source": {
    "book": "Livro do Jogador 2024",
    "language": "pt-BR",
    "chapter": 7,
    "chapterTitle": "Magias",
    "pdfPath": "doc/livro-jogador.pdf",
    "pdfPages": [
      241,
      349
    ],
    "extractedAt": "2026-06-25T01:53:01.648Z"
  }
}
