{
  "$schema": "../../schema/spell.schema.json",
  "id": "palavra-de-poder-fortificar",
  "name": "Palavra de Poder: Fortificar",
  "level": 7,
  "levelLabel": "7º Círculo",
  "school": "Encantamento",
  "classes": [
    "Bardo",
    "Clérigo"
  ],
  "castingTime": "Ação",
  "range": "18 metros",
  "components": {
    "verbal": true,
    "somatic": false,
    "material": false,
    "materialDescription": null,
    "text": "V"
  },
  "duration": "Instantânea",
  "concentration": false,
  "ritual": false,
  "description": "Você fortalece até seis criaturas à sua vista e no alcance da magia. A magia concede 120 Pontos de Vida Temporários, que você divide entre os alvos da magia.",
  "source": {
    "book": "Livro do Jogador 2024",
    "language": "pt-BR",
    "chapter": 7,
    "chapterTitle": "Magias",
    "pdfPath": "doc/livro-jogador.pdf",
    "pdfPages": [
      241,
      349
    ],
    "extractedAt": "2026-06-25T01:53:01.606Z"
  }
}
