{
  "$schema": "../../schema/spell.schema.json",
  "id": "banquete-de-herois",
  "name": "Banquete de Heróis",
  "level": 6,
  "levelLabel": "6º Círculo",
  "school": "Invocação",
  "classes": [
    "Bardo",
    "Clérigo",
    "Druida"
  ],
  "castingTime": "10 minutos",
  "range": "Pessoal",
  "components": {
    "verbal": true,
    "somatic": true,
    "material": true,
    "materialDescription": "uma tigela incrustada de pedras preciosas no valor de 1.000 ou mais PO, que a magia consome",
    "text": "V, S, M (uma tigela incrustada de pedras preciosas no valor de 1.000 ou mais PO, que a magia consome)"
  },
  "duration": "Instantânea",
  "concentration": false,
  "ritual": false,
  "description": "Você conjura um banquete que aparece em uma superfície em um Cubo desocupado de 3 metros de lado próximo a você. O banquete leva 1 hora para ser consumido e desaparece no final dessa duração, e os efeitos benéficos não aparecem até que essa hora passe. Até doze criaturas podem participar do banquete.\nUma criatura que partilha do banquete recebe vários benefícios, que duram 24 horas. A criatura tem\nResistência a dano Venenoso e Imunidade às condições\nAmedrontado e Envenenado. Seus Pontos de Vida máximos também aumentam em 2d10 e recebe o mesmo valor de Pontos de Vida.",
  "source": {
    "book": "Livro do Jogador 2024",
    "language": "pt-BR",
    "chapter": 7,
    "chapterTitle": "Magias",
    "pdfPath": "doc/livro-jogador.pdf",
    "pdfPages": [
      241,
      349
    ],
    "extractedAt": "2026-06-25T01:53:01.502Z"
  }
}
