{
  "$schema": "../../schema/spell.schema.json",
  "id": "contramagia",
  "name": "Contramagia",
  "level": 3,
  "levelLabel": "3º Círculo",
  "school": "Abjuração",
  "classes": [
    "Bruxo",
    "Feiticeiro",
    "Mago"
  ],
  "castingTime": "Reação, que você executa quando vê\numa criatura a até 18 metros de você conjurando uma magia com componentes Verbais, Somáticos ou Materiais",
  "range": "18 metros",
  "components": {
    "verbal": false,
    "somatic": true,
    "material": false,
    "materialDescription": null,
    "text": "S"
  },
  "duration": "Instantânea",
  "concentration": false,
  "ritual": false,
  "description": "Você tenta interromper uma criatura no processo de conjurar uma magia. A criatura realiza uma salvaguarda de Constituição. Se falhar, a magia se dissipa sem efeito, e a ação, Ação Bônus ou Reação usada para conjurá-la é desperdiçada. Se a magia do alvo foi conjurada com um espaço de magia, o espaço de magia da criatura não é gasto.",
  "source": {
    "book": "Livro do Jogador 2024",
    "language": "pt-BR",
    "chapter": 7,
    "chapterTitle": "Magias",
    "pdfPath": "doc/livro-jogador.pdf",
    "pdfPages": [
      241,
      349
    ],
    "extractedAt": "2026-06-25T01:53:01.522Z"
  }
}
