{
  "$schema": "../../schema/spell.schema.json",
  "id": "raio-guia",
  "name": "Raio Guia",
  "level": 1,
  "levelLabel": "1º Círculo",
  "school": "Evocação",
  "classes": [
    "Clérigo"
  ],
  "castingTime": "Ação",
  "range": "36 metros",
  "components": {
    "verbal": true,
    "somatic": true,
    "material": false,
    "materialDescription": null,
    "text": "V, S"
  },
  "duration": "1 rodada",
  "concentration": false,
  "ritual": false,
  "description": "Você lança um raio de luz em direção a uma criatura no alcance da magia. Realize um ataque mágico à distância contra o alvo. Em caso de acerto, ele sofre 4d6\npontos de dano Radiante, e a próxima jogada de ataque realizado contra ele antes do final do seu próximo turno tem Vantagem.",
  "higherLevels": "Usando um Espaço de Magia de Círculo Superior. O\ndano aumenta em 1d6 pontos para cada círculo de espaço de magia acima de 1.",
  "source": {
    "book": "Livro do Jogador 2024",
    "language": "pt-BR",
    "chapter": 7,
    "chapterTitle": "Magias",
    "pdfPath": "doc/livro-jogador.pdf",
    "pdfPages": [
      241,
      349
    ],
    "extractedAt": "2026-06-25T01:53:01.623Z"
  }
}
