{
  "$schema": "../../schema/spell.schema.json",
  "id": "arca-secreta-de-leomund",
  "name": "Arca Secreta de Leomund",
  "level": 4,
  "levelLabel": "4º Círculo",
  "school": "Invocação",
  "classes": [
    "Mago"
  ],
  "castingTime": "Ação",
  "range": "Toque",
  "components": {
    "verbal": true,
    "somatic": true,
    "material": true,
    "materialDescription": "um baú de 1 m por 60 cm por 60 cm, construído com materiais raros no valor de 5.000 ou mais PO, e uma réplica minúscula do baú fabricada com os mesmos materiais no valor de 50 ou mais PO",
    "text": "V, S, M (um baú de 1 m por 60 cm por 60 cm, construído com materiais raros no valor de 5.000 ou mais PO, e uma réplica minúscula do baú fabricada com os mesmos materiais no valor de 50 ou mais PO)"
  },
  "duration": "Até ser dissipada",
  "concentration": false,
  "ritual": false,
  "description": "Você esconde um baú e todo o seu conteúdo no Plano\nEtéreo. Você deve tocar no baú e na réplica em miniatura que servem como componentes Materiais para a magia. O baú pode armazenar até 340 litros de material não vivo (1 m por 60 cm por 60 cm).\nEnquanto o baú permanecer no Plano Etéreo, você\npode executar uma ação Usar Magia e tocar na réplica para recuperar o baú. Ele aparece em um espaço desocupado no chão a até 1,5 metro de você. Você pode enviar o baú de volta ao Plano Etéreo como uma ação\nUsar Magia para tocar o baú e a réplica.\nApós 60 dias, há uma chance cumulativa de 5% no final de cada dia de que a magia encerre. A magia também se encerra se você conjurá-la novamente ou se a réplica Minúscula for destruída. Se a magia encerrar e o baú maior estiver no Plano Etéreo, o baú permanece lá para você ou outra pessoa encontrar.",
  "source": {
    "book": "Livro do Jogador 2024",
    "language": "pt-BR",
    "chapter": 7,
    "chapterTitle": "Magias",
    "pdfPath": "doc/livro-jogador.pdf",
    "pdfPages": [
      241,
      349
    ],
    "extractedAt": "2026-06-25T01:53:01.492Z"
  }
}
