{
  "$schema": "../../schema/spell.schema.json",
  "id": "piscar",
  "name": "Piscar",
  "level": 3,
  "levelLabel": "3º Círculo",
  "school": "Transmutação",
  "classes": [
    "Feiticeiro",
    "Mago"
  ],
  "castingTime": "Ação",
  "range": "Pessoal",
  "components": {
    "verbal": true,
    "somatic": true,
    "material": false,
    "materialDescription": null,
    "text": "V, S"
  },
  "duration": "1 minuto",
  "concentration": false,
  "ritual": false,
  "description": "Jogue 1d6 no final de cada um dos seus turnos pela duração da magia. Em um resultado de 4−6, você\ndesaparece do seu plano de existência atual e aparece no Plano Etéreo (a magia termina instantaneamente se você já estiver nesse plano). Enquanto estiver no Plano\nEtéreo, você pode ver o plano que você deixou, que aparece em tons de cinza, mas você não pode ver nada nele a mais de 18 metros de distância. Você só pode afetar e ser afetado por criaturas que estejam no Plano\nEtéreo, e criaturas no outro plano não podem percebê-\n-lo, a menos que tenham uma habilidade específica que lhes permita perceber coisas no Plano Etéreo.\nVocê retorna ao outro plano no início do seu próximo turno e quando a magia termina se você estiver no\nPlano Etéreo. Você retorna a um espaço desocupado à\nsua escolha à sua vista e a até 3 metros do espaço que deixou. Se nenhum espaço desocupado estiver disponível dentro desse intervalo, você aparece no espaço desocupado mais próximo.",
  "source": {
    "book": "Livro do Jogador 2024",
    "language": "pt-BR",
    "chapter": 7,
    "chapterTitle": "Magias",
    "pdfPath": "doc/livro-jogador.pdf",
    "pdfPages": [
      241,
      349
    ],
    "extractedAt": "2026-06-25T01:53:01.612Z"
  }
}
